feedback_id,customer_id,customer_name,product_category,product_name,feedback_channel,feedback_date,feedback_type,feedback_score,comments,agent_id,response_time_hrs,region,value_domain,data_segment,data_domain
FDB100359,CUST16102,Bryan Lopez,Electronics,ELE-230,In-Store Kiosk,2025-06-04,Neutral,10,Pull thank option explain day artist seek reach evidence simple evening.,AGT311,38.55,South,Process,Customer Servicing,Product Feedback
FDB100360,CUST13066,Cassandra Carter,Electronics,ELE-334,In-Store Kiosk,2025-02-17,Complaint,3,Skill study can dark itself happy us skin.,AGT967,38.18,Central,Process,Customer Servicing,Product Feedback
FDB100361,CUST12712,Sara Jones,Sports,SPO-410,Mobile App,2024-11-27,Complaint,10,Others work while weight difficult whether floor.,AGT188,25.21,North,Process,Customer Servicing,Product Feedback
FDB100362,CUST18394,Alexandra Hall,Fashion,FAS-317,In-Store Kiosk,2025-07-04,Complaint,2,Start discuss exactly even small live hour capital girl local develop community coach attorney.,AGT756,16.16,West,Process,Customer Servicing,Product Feedback
FDB100363,CUST18746,Damon Jackson,Appliances,APP-349,Social Media,2025-10-05,Complaint,10,Listen south director suggest and conference lot risk program nation child daughter identify grow together.,AGT795,43.38,Central,Process,Customer Servicing,Product Feedback
FDB100364,CUST13479,Melinda Myers,Furniture,FUR-175,Email,2025-03-27,Complaint,4,Subject leg method provide hair allow system floor.,AGT936,8.93,South,Process,Customer Servicing,Product Feedback
FDB100365,CUST16344,Tracey Smith,Healthcare,HEA-592,In-Store Kiosk,2025-08-25,Suggestion,3,Also computer past stay eye this piece something value base respond up.,AGT183,26.64,East,Process,Customer Servicing,Product Feedback
FDB100366,CUST19642,Eric Hall,Fashion,FAS-272,Social Media,2025-02-25,Negative,2,Operation describe world hospital stock.,AGT441,24.05,North,Process,Customer Servicing,Product Feedback
FDB100367,CUST15271,Rachel Beck,Furniture,FUR-576,In-Store Kiosk,2025-07-06,Negative,1,Save understand father friend degree.,AGT733,47.97,Central,Process,Customer Servicing,Product Feedback
FDB100368,CUST11088,Philip Briggs,Electronics,ELE-837,Web Portal,2025-02-15,Suggestion,3,Stop population best cut until.,AGT932,19.47,East,Process,Customer Servicing,Product Feedback
FDB100369,CUST13660,Eric Booth,Healthcare,HEA-377,Web Portal,2025-09-17,Positive,8,Prove cultural of back other bring opportunity chance.,AGT735,4.62,South,Process,Customer Servicing,Product Feedback
FDB100370,CUST17944,Kyle Mills,Furniture,FUR-434,Email,2025-03-13,Complaint,4,Lose father environment according miss skill.,AGT431,25.32,North,Process,Customer Servicing,Product Feedback
FDB100371,CUST15251,Ann White DDS,Electronics,ELE-394,Social Media,2025-01-04,Neutral,9,Miss easy movie bag represent course full interview.,AGT576,15.62,West,Process,Customer Servicing,Product Feedback
FDB100372,CUST16540,Mr. William Lambert,Healthcare,HEA-840,Web Portal,2025-10-03,Suggestion,1,Administration keep threat week effect lay floor yes pretty energy nation follow everybody seek across community.,AGT642,39.41,West,Process,Customer Servicing,Product Feedback
FDB100373,CUST11010,William Mckee,Automobile,AUT-491,Web Portal,2025-09-29,Negative,8,Consider various for sister country development recently current tough fight yes.,AGT533,18.96,North,Process,Customer Servicing,Product Feedback
FDB100374,CUST13644,Benjamin Cunningham,Fashion,FAS-676,Web Portal,2024-12-10,Suggestion,9,Impact myself if growth scientist animal send stop.,AGT162,47.86,Central,Process,Customer Servicing,Product Feedback
FDB100375,CUST17682,David Nicholson,Sports,SPO-329,Social Media,2025-06-17,Suggestion,1,Last important deep whole adult again gas.,AGT981,36.54,East,Process,Customer Servicing,Product Feedback
FDB100376,CUST10375,Marie Richardson,Fashion,FAS-513,In-Store Kiosk,2024-11-26,Complaint,1,Education election truth get after send seat five head reach want table place large.,AGT911,12.2,East,Process,Customer Servicing,Product Feedback
FDB100377,CUST15848,Edward Zimmerman,Sports,SPO-746,Email,2024-12-04,Positive,8,Experience example now boy decision sound interview today sense conference also.,AGT199,14.6,Central,Process,Customer Servicing,Product Feedback
FDB100378,CUST19832,Ronald Gray,Fashion,FAS-798,Mobile App,2024-10-16,Suggestion,2,Perform Republican protect media capital him high cultural order first end various Congress wrong that.,AGT715,41.74,East,Process,Customer Servicing,Product Feedback
FDB100379,CUST15892,Cynthia Kemp,Automobile,AUT-956,Web Portal,2025-01-29,Negative,9,Though federal no black cold vote indicate radio main five surface economy though bank.,AGT544,17.75,West,Process,Customer Servicing,Product Feedback
FDB100380,CUST10920,Jo Lawrence,Furniture,FUR-729,In-Store Kiosk,2025-04-18,Complaint,7,Reason own special executive those north recognize front travel.,AGT541,22.37,Central,Process,Customer Servicing,Product Feedback
FDB100381,CUST18955,Elizabeth Hicks,Fashion,FAS-693,In-Store Kiosk,2025-08-04,Neutral,9,Memory series detail establish doctor radio.,AGT466,31.38,North,Process,Customer Servicing,Product Feedback
FDB100382,CUST13424,Samantha Allen,Automobile,AUT-402,In-Store Kiosk,2025-08-10,Neutral,5,Purpose toward truth factor unit four factor want argue century middle eye ability.,AGT851,42.77,South,Process,Customer Servicing,Product Feedback
FDB100383,CUST12286,Katherine Salas,Furniture,FUR-361,Social Media,2025-02-02,Negative,2,Reduce family recognize money hard new into court blood.,AGT566,4.24,West,Process,Customer Servicing,Product Feedback
FDB100384,CUST17009,James Erickson,Sports,SPO-222,In-Store Kiosk,2025-06-22,Complaint,4,Bank enter condition coach company idea respond government know assume themselves history south station market article late table dream.,AGT937,18.82,North,Process,Customer Servicing,Product Feedback
FDB100385,CUST15800,Mark Fischer,Fashion,FAS-435,In-Store Kiosk,2025-07-13,Neutral,5,Everybody chair feel nothing line.,AGT993,30.63,South,Process,Customer Servicing,Product Feedback
FDB100386,CUST19347,Courtney Meadows,Appliances,APP-663,In-Store Kiosk,2024-11-27,Positive,3,White avoid where step focus media way.,AGT353,43.51,South,Process,Customer Servicing,Product Feedback
FDB100387,CUST19369,Michelle Hampton,Electronics,ELE-332,Email,2025-01-03,Negative,8,Also customer drive station cut if need maintain right.,AGT194,15.65,East,Process,Customer Servicing,Product Feedback
FDB100388,CUST18510,Benjamin Brewer,Electronics,ELE-476,Social Media,2024-10-20,Complaint,3,Past despite new beyond exactly be hit.,AGT106,43.26,South,Process,Customer Servicing,Product Feedback
FDB100389,CUST18392,Thomas Cook,Appliances,APP-205,Social Media,2025-05-16,Negative,3,Glass four my it computer short pick.,AGT132,42.85,South,Process,Customer Servicing,Product Feedback
FDB100390,CUST10930,Anthony Edwards,Automobile,AUT-202,Mobile App,2025-03-14,Complaint,3,Early apply lead clear my offer sea.,AGT677,17.66,East,Process,Customer Servicing,Product Feedback
FDB100391,CUST16587,Samantha King,Fashion,FAS-625,Mobile App,2025-02-15,Complaint,8,Night why middle south.,AGT307,33.64,West,Process,Customer Servicing,Product Feedback
FDB100392,CUST16604,Mary Stein,Fashion,FAS-320,Email,2025-06-20,Positive,1,Executive partner chair least soldier day her say could.,AGT310,47.61,South,Process,Customer Servicing,Product Feedback
FDB100393,CUST12285,Amber Lin,Furniture,FUR-941,Email,2025-07-18,Negative,8,Student lay different near hope drug future budget two loss admit science.,AGT785,4.08,West,Process,Customer Servicing,Product Feedback
FDB100394,CUST14433,Matthew Taylor,Sports,SPO-896,Mobile App,2025-01-10,Neutral,4,Another ever plant practice so science rate.,AGT754,22.59,North,Process,Customer Servicing,Product Feedback
FDB100395,CUST17568,Tracy Perez,Healthcare,HEA-283,In-Store Kiosk,2025-09-21,Suggestion,4,Change red give challenge stage fill capital case popular professor.,AGT986,42.99,East,Process,Customer Servicing,Product Feedback
FDB100396,CUST19782,Wayne Anderson,Healthcare,HEA-387,Email,2024-12-18,Negative,7,Decade improve form little general will effect nearly woman I society wrong others dinner.,AGT937,13.41,South,Process,Customer Servicing,Product Feedback
FDB100397,CUST11197,Mr. James Pena,Appliances,APP-149,Email,2025-01-09,Negative,9,Subject baby trial report your.,AGT802,28.82,Central,Process,Customer Servicing,Product Feedback
FDB100398,CUST11651,Garrett Spencer,Electronics,ELE-146,Mobile App,2025-01-12,Positive,3,Itself seven great full discover however.,AGT269,4.2,South,Process,Customer Servicing,Product Feedback
FDB100399,CUST16090,Donald Aguilar,Healthcare,HEA-406,Email,2025-03-03,Negative,10,Environment system information significant three cause hour same stay black nice sure information energy short usually sometimes.,AGT999,1.81,South,Process,Customer Servicing,Product Feedback
FDB100400,CUST19458,Darrell Clay,Fashion,FAS-237,Mobile App,2025-08-23,Negative,3,Not mention force method already support set sport begin put collection blue course record respond practice.,AGT874,37.39,East,Process,Customer Servicing,Product Feedback
FDB100401,CUST15667,Richard Smith,Appliances,APP-114,Social Media,2025-01-26,Complaint,7,Put company attorney year effort.,AGT411,34.4,East,Process,Customer Servicing,Product Feedback
FDB100402,CUST11369,Denise Holmes,Electronics,ELE-882,Web Portal,2025-09-02,Complaint,10,Past clear beautiful firm common act teach summer measure any huge away provide sing history.,AGT463,24.94,Central,Process,Customer Servicing,Product Feedback
FDB100403,CUST13876,Margaret Simmons,Automobile,AUT-355,Web Portal,2025-06-22,Neutral,8,Effort amount so indeed forward early foreign eat nothing want.,AGT399,4.68,East,Process,Customer Servicing,Product Feedback
FDB100404,CUST15968,Kimberly Johnson,Furniture,FUR-355,Mobile App,2025-07-28,Suggestion,1,Discussion free statement rule international speak son job better kind in civil.,AGT391,28.36,West,Process,Customer Servicing,Product Feedback
FDB100405,CUST18303,Vincent Reilly,Automobile,AUT-748,Mobile App,2024-12-13,Positive,10,Give thank southern still reason attention test history buy yard dinner.,AGT490,27.1,Central,Process,Customer Servicing,Product Feedback
FDB100406,CUST11686,Donald Martinez,Fashion,FAS-496,Mobile App,2024-11-18,Neutral,3,Call us add foreign church travel maybe choose health yourself animal recently enter bad.,AGT624,26.01,South,Process,Customer Servicing,Product Feedback
FDB100407,CUST12212,Robert Mcdonald,Automobile,AUT-956,Mobile App,2025-10-16,Suggestion,5,Camera clear boy address break deal character hospital how wind.,AGT796,8.99,South,Process,Customer Servicing,Product Feedback
FDB100408,CUST17208,Sarah Collins,Automobile,AUT-473,Web Portal,2025-01-27,Complaint,6,Top discuss class.,AGT846,34.89,West,Process,Customer Servicing,Product Feedback
FDB100409,CUST10308,Tracy Walker,Fashion,FAS-260,Web Portal,2025-02-21,Suggestion,4,Raise oil education source stop do without call specific.,AGT191,14.55,South,Process,Customer Servicing,Product Feedback
FDB100410,CUST18940,Nicole Wallace,Healthcare,HEA-943,Social Media,2025-02-05,Complaint,2,Cause sound politics line rule reflect character southern arm lead story firm court each rest.,AGT183,29.69,Central,Process,Customer Servicing,Product Feedback
FDB100411,CUST19312,Dr. Shane Adams,Furniture,FUR-352,In-Store Kiosk,2025-02-24,Positive,8,Billion positive remember health court central court personal card hard.,AGT879,19.64,North,Process,Customer Servicing,Product Feedback
FDB100412,CUST19215,Melissa Love,Electronics,ELE-327,Email,2024-10-25,Neutral,6,Could contain than bag nation whole.,AGT327,1.06,South,Process,Customer Servicing,Product Feedback
FDB100413,CUST13158,Tina Riley,Appliances,APP-604,Email,2025-01-03,Suggestion,10,Smile list not begin size tree part according my standard later show far director family.,AGT112,36.41,South,Process,Customer Servicing,Product Feedback
FDB100414,CUST17915,Omar Mccarty,Sports,SPO-472,Mobile App,2025-09-17,Complaint,3,Sure government anything kitchen past Congress scientist.,AGT476,14.76,North,Process,Customer Servicing,Product Feedback
FDB100415,CUST10398,Vincent Walker,Automobile,AUT-397,Email,2025-01-27,Positive,8,Economic simply director technology improve bed involve happy good different from eat test yes wide with.,AGT765,23.28,South,Process,Customer Servicing,Product Feedback
FDB100416,CUST14715,Roberto Roberts,Healthcare,HEA-621,Mobile App,2024-10-19,Neutral,7,Dinner brother second consumer yes factor ask specific on only show.,AGT649,38.3,North,Process,Customer Servicing,Product Feedback
FDB100417,CUST14135,Amy Crane,Sports,SPO-182,Email,2025-04-03,Suggestion,1,Though development name Congress class information.,AGT968,23.07,Central,Process,Customer Servicing,Product Feedback
FDB100418,CUST16290,Dillon Robinson,Furniture,FUR-650,Email,2024-11-05,Suggestion,5,Owner mission according size sell these base land.,AGT558,2.69,South,Process,Customer Servicing,Product Feedback
FDB100419,CUST16403,Christopher Montgomery,Sports,SPO-475,In-Store Kiosk,2025-01-14,Complaint,4,Economy though product shake morning letter study.,AGT694,36.09,Central,Process,Customer Servicing,Product Feedback
FDB100420,CUST18270,Patrick Hoffman,Furniture,FUR-359,Mobile App,2024-11-20,Negative,2,Drive brother process gas expect analysis film space top begin case summer necessary tree learn data woman put.,AGT622,31.51,West,Process,Customer Servicing,Product Feedback
FDB100421,CUST13467,Christine Simpson,Furniture,FUR-620,Email,2024-10-28,Suggestion,2,Myself thing enter sport reality light at hotel year your.,AGT461,8.15,South,Process,Customer Servicing,Product Feedback
FDB100422,CUST10476,Crystal Chavez,Electronics,ELE-726,In-Store Kiosk,2025-07-18,Neutral,5,Even a employee meeting.,AGT189,4.55,Central,Process,Customer Servicing,Product Feedback
FDB100423,CUST19231,Kevin Jones,Automobile,AUT-794,Email,2025-04-03,Positive,7,Feeling sea bank city Mr fear bank material and you former job.,AGT115,16.2,South,Process,Customer Servicing,Product Feedback
FDB100424,CUST16759,Brianna Munoz,Sports,SPO-813,Email,2025-05-21,Suggestion,8,Purpose themselves bad long able.,AGT946,41.33,North,Process,Customer Servicing,Product Feedback
FDB100425,CUST19363,Dr. Darrell Mercado,Healthcare,HEA-419,Social Media,2024-12-02,Negative,4,East always answer concern fact sport loss might head arrive ten.,AGT213,41.87,Central,Process,Customer Servicing,Product Feedback
FDB100426,CUST10314,Jason Brown,Sports,SPO-502,Email,2025-01-08,Suggestion,10,Yard particular bill newspaper detail true his claim health political.,AGT783,22.13,South,Process,Customer Servicing,Product Feedback
FDB100427,CUST15832,Leslie Stuart,Healthcare,HEA-766,Social Media,2024-12-02,Negative,1,Sit for red already.,AGT571,46.8,West,Process,Customer Servicing,Product Feedback
FDB100428,CUST13896,Linda Stevens,Fashion,FAS-873,In-Store Kiosk,2025-10-10,Suggestion,1,It lay partner bring that hundred lawyer.,AGT137,32.77,West,Process,Customer Servicing,Product Feedback
FDB100429,CUST18092,Belinda Wallace,Fashion,FAS-504,Email,2025-09-05,Negative,4,Condition before maintain mention local water ground.,AGT957,16.59,West,Process,Customer Servicing,Product Feedback
FDB100430,CUST18946,Lisa Griffin,Appliances,APP-413,Web Portal,2025-05-10,Negative,3,It national while performance space first by find.,AGT172,47.19,Central,Process,Customer Servicing,Product Feedback
FDB100431,CUST19355,Ray Edwards,Healthcare,HEA-833,Social Media,2025-07-07,Positive,4,Participant get kind move lose throw action shake in money quality enough story turn.,AGT124,29.49,East,Process,Customer Servicing,Product Feedback
FDB100432,CUST18987,Christine Romero,Fashion,FAS-320,Email,2025-09-24,Suggestion,10,Poor chance what main pick point.,AGT362,11.74,East,Process,Customer Servicing,Product Feedback
FDB100433,CUST12363,Taylor Johnson,Sports,SPO-319,Email,2025-06-25,Positive,2,Difference project almost goal material rather long.,AGT584,31.72,East,Process,Customer Servicing,Product Feedback
FDB100434,CUST11325,Virginia Johnson,Electronics,ELE-355,Email,2025-03-18,Complaint,8,Before personal compare difference country book fight heavy.,AGT946,6.55,North,Process,Customer Servicing,Product Feedback
FDB100435,CUST14154,James Boyd,Sports,SPO-501,In-Store Kiosk,2025-05-20,Negative,1,With senior still opportunity whatever blue listen.,AGT957,28.52,Central,Process,Customer Servicing,Product Feedback
FDB100436,CUST10421,Julie Perez,Automobile,AUT-828,In-Store Kiosk,2025-07-01,Suggestion,1,Force include let sure more smile media three baby agreement staff.,AGT430,2.44,North,Process,Customer Servicing,Product Feedback
FDB100437,CUST15841,Kristin Douglas,Sports,SPO-524,Web Portal,2025-01-05,Positive,8,General city people become bring maybe his create.,AGT994,8.74,South,Process,Customer Servicing,Product Feedback
FDB100438,CUST19101,Michael Smith,Electronics,ELE-957,Social Media,2025-03-03,Complaint,7,Artist management truth expect particular doctor picture care strong hundred because.,AGT849,29.36,Central,Process,Customer Servicing,Product Feedback
FDB100439,CUST17691,Felicia Snyder,Sports,SPO-848,Web Portal,2025-06-09,Neutral,1,Also pattern doctor effect fill ago analysis road forward.,AGT231,2.13,West,Process,Customer Servicing,Product Feedback
FDB100440,CUST15825,Stephanie Alvarado,Fashion,FAS-228,Web Portal,2025-07-08,Complaint,1,Whose weight city management floor.,AGT333,15.25,Central,Process,Customer Servicing,Product Feedback
FDB100441,CUST12454,Juan Finley,Healthcare,HEA-437,Email,2025-07-21,Positive,3,Material candidate affect interest bit ready until huge medical mouth pass edge near here.,AGT501,23.4,West,Process,Customer Servicing,Product Feedback
FDB100442,CUST11145,Andrea Mathis,Furniture,FUR-213,Web Portal,2025-10-08,Positive,3,Though century strong direction wind same need difference would center sea cut crime piece.,AGT485,46.11,North,Process,Customer Servicing,Product Feedback
FDB100443,CUST12181,Holly Joyce,Furniture,FUR-453,In-Store Kiosk,2025-01-21,Negative,4,Order town individual economy control growth black summer.,AGT889,39.67,South,Process,Customer Servicing,Product Feedback
FDB100444,CUST12951,William Haynes,Appliances,APP-863,Mobile App,2025-03-06,Positive,6,Growth culture I time whom teacher start those pretty chance section major hold generation stock.,AGT223,2.46,Central,Process,Customer Servicing,Product Feedback
FDB100445,CUST13541,Michelle Brown,Furniture,FUR-379,In-Store Kiosk,2024-10-31,Suggestion,1,Section officer believe heavy soldier rock too capital laugh few alone under director professor charge there best break left seem.,AGT457,14.51,West,Process,Customer Servicing,Product Feedback
FDB100446,CUST10983,Susan Jackson,Electronics,ELE-602,Mobile App,2025-06-06,Negative,9,Hour line his daughter itself range list feeling why wind personal join media exist now factor source natural water top.,AGT343,2.82,West,Process,Customer Servicing,Product Feedback
FDB100447,CUST18267,Jason Day,Sports,SPO-651,Email,2025-01-13,Negative,3,Late responsibility suffer dream research.,AGT665,32.09,Central,Process,Customer Servicing,Product Feedback
FDB100448,CUST12005,Laura Gilbert,Healthcare,HEA-426,In-Store Kiosk,2025-07-20,Suggestion,1,Region question these ready them as fish moment cause theory guess wrong shake better walk white citizen.,AGT783,9.11,Central,Process,Customer Servicing,Product Feedback
FDB100449,CUST13680,Devin Johnson,Sports,SPO-371,Mobile App,2025-04-12,Neutral,3,Common whom model type.,AGT847,30.53,North,Process,Customer Servicing,Product Feedback
FDB100450,CUST11530,Amy Johnson,Appliances,APP-491,Web Portal,2024-12-08,Complaint,2,Approach modern politics idea others region simply heavy four wait again can.,AGT960,10.26,Central,Process,Customer Servicing,Product Feedback
FDB100451,CUST19039,James Shaw,Electronics,ELE-178,Social Media,2025-03-25,Complaint,5,Professor beyond image decide management structure too pretty.,AGT487,14.24,South,Process,Customer Servicing,Product Feedback
FDB100452,CUST14379,Sheryl Rodriguez,Sports,SPO-554,Email,2025-10-09,Positive,5,Clear wide west white including yes foot.,AGT714,39.81,South,Process,Customer Servicing,Product Feedback
FDB100453,CUST13793,Justin Palmer,Fashion,FAS-495,Social Media,2025-06-15,Suggestion,10,Often give oil letter short understand board.,AGT883,46.37,West,Process,Customer Servicing,Product Feedback
FDB100454,CUST17045,Alison Anderson,Appliances,APP-766,Social Media,2025-09-02,Positive,2,Respond knowledge expect image protect suffer feeling.,AGT602,11.95,North,Process,Customer Servicing,Product Feedback
FDB100455,CUST15934,Elizabeth Myers,Electronics,ELE-939,Mobile App,2025-03-11,Suggestion,9,Camera media meeting recognize perhaps three six price director.,AGT825,7.31,West,Process,Customer Servicing,Product Feedback
FDB100456,CUST19579,Elizabeth Brady DVM,Electronics,ELE-440,Email,2025-09-08,Complaint,7,Leg agent add appear analysis heavy work truth skin very late draw throw perform sign citizen especially participant.,AGT886,13.69,Central,Process,Customer Servicing,Product Feedback
FDB100457,CUST11346,Joshua Craig,Sports,SPO-891,Mobile App,2025-07-04,Neutral,10,Perhaps respond someone defense member voice talk meeting no sell wonder describe form really.,AGT809,41.25,Central,Process,Customer Servicing,Product Feedback
FDB100458,CUST12674,Gabriel Campbell,Fashion,FAS-468,In-Store Kiosk,2024-12-03,Suggestion,8,Chance against believe cup image brother get board draw from.,AGT524,43.6,West,Process,Customer Servicing,Product Feedback
FDB100459,CUST12365,Mr. John Mccann,Furniture,FUR-488,Email,2025-07-16,Suggestion,7,Great look movie make community kitchen fast bring green detail not listen.,AGT608,15.68,West,Process,Customer Servicing,Product Feedback
FDB100460,CUST17347,Micheal Rodriguez,Sports,SPO-214,Email,2025-07-30,Suggestion,8,Politics seek both include boy have red the air physical return too brother realize industry bill.,AGT507,2.76,Central,Process,Customer Servicing,Product Feedback
FDB100461,CUST10830,Emily Crawford,Automobile,AUT-542,Social Media,2025-09-05,Neutral,4,Above material even professional positive serve.,AGT890,2.65,West,Process,Customer Servicing,Product Feedback
FDB100462,CUST10376,Jason Lawrence,Electronics,ELE-153,Mobile App,2025-06-10,Neutral,1,West worry continue forward author public institution early health minute.,AGT271,37.8,Central,Process,Customer Servicing,Product Feedback
FDB100463,CUST19861,Jennifer Taylor,Healthcare,HEA-945,Web Portal,2024-12-14,Neutral,1,Ability mouth garden better race lot me.,AGT841,8.65,Central,Process,Customer Servicing,Product Feedback
FDB100464,CUST15818,Cynthia Benson,Fashion,FAS-490,Email,2025-09-12,Neutral,1,Physical kid wait only station truth maybe officer kitchen indicate.,AGT464,45.86,North,Process,Customer Servicing,Product Feedback
FDB100465,CUST10838,Steven Price,Furniture,FUR-272,Email,2025-05-06,Neutral,10,Rest remember keep political whole add natural score.,AGT721,24.31,South,Process,Customer Servicing,Product Feedback
FDB100466,CUST19867,Mitchell Wilson,Sports,SPO-545,Email,2024-12-30,Positive,5,Anything kid its design body condition.,AGT934,3.01,Central,Process,Customer Servicing,Product Feedback
FDB100467,CUST17833,Kelly Johnson,Automobile,AUT-197,Email,2025-09-15,Negative,4,Room plan of class budget throughout more off if anyone.,AGT586,29.31,West,Process,Customer Servicing,Product Feedback
FDB100468,CUST11997,Todd Sanders,Healthcare,HEA-481,In-Store Kiosk,2025-10-09,Suggestion,3,Radio blue list experience across middle speech.,AGT624,21.2,West,Process,Customer Servicing,Product Feedback
FDB100469,CUST10353,Rodney Sawyer,Furniture,FUR-435,Email,2025-05-24,Neutral,1,Discussion a home chair address relationship hope believe structure describe.,AGT494,2.71,South,Process,Customer Servicing,Product Feedback
FDB100470,CUST17150,Mary Anderson,Automobile,AUT-279,Mobile App,2025-01-07,Negative,4,Next memory manage majority they ask interest conference half.,AGT366,9.13,West,Process,Customer Servicing,Product Feedback
FDB100471,CUST15037,Michael Garner,Automobile,AUT-953,In-Store Kiosk,2025-08-17,Complaint,8,Tough like summer specific how beyond once bring hit.,AGT396,28.34,East,Process,Customer Servicing,Product Feedback
FDB100472,CUST14630,Theresa Keller,Fashion,FAS-972,Mobile App,2025-04-12,Suggestion,4,Value allow loss ever you performance war.,AGT945,37.84,South,Process,Customer Servicing,Product Feedback
FDB100473,CUST16985,Allison Carter,Automobile,AUT-850,Web Portal,2025-06-09,Positive,3,Each goal serve yard near technology.,AGT940,14.15,West,Process,Customer Servicing,Product Feedback
FDB100474,CUST13197,Jonathan Fritz,Sports,SPO-479,Mobile App,2025-03-03,Suggestion,8,Body simple add bank magazine size within late story especially garden.,AGT849,16.42,East,Process,Customer Servicing,Product Feedback
FDB100475,CUST16494,Christina Perez,Appliances,APP-277,In-Store Kiosk,2025-05-21,Complaint,1,Star expect wrong anything tree manage painting week represent whatever matter idea themselves gun.,AGT360,33.7,North,Process,Customer Servicing,Product Feedback
FDB100476,CUST16271,David Rodriguez,Sports,SPO-985,Social Media,2025-07-21,Neutral,7,Play arrive party tough half system office reach if think keep response item environment phone family process security wish white.,AGT715,3.86,East,Process,Customer Servicing,Product Feedback
FDB100477,CUST18409,Michelle Horn,Healthcare,HEA-737,Mobile App,2025-02-13,Negative,6,Southern strategy either build prepare purpose simple.,AGT197,34.21,Central,Process,Customer Servicing,Product Feedback
FDB100478,CUST11645,Mr. Cody Buchanan,Electronics,ELE-487,Web Portal,2025-09-15,Positive,6,High accept vote then effect rule structure recent type year attorney subject surface listen those true much.,AGT814,20.62,East,Process,Customer Servicing,Product Feedback
