feedback_id,customer_id,customer_name,product_category,product_name,feedback_channel,feedback_date,feedback_type,feedback_score,comments,agent_id,response_time_hrs,region,value_domain,data_segment,data_domain
FDB100240,CUST18449,Bruce Jackson,Sports,SPO-555,Mobile App,2024-11-27,Positive,5,Language explain economy build some early show expect financial serve after involve.,AGT917,21.21,North,Process,Customer Servicing,Product Feedback
FDB100241,CUST15231,Timothy Martinez,Furniture,FUR-514,Mobile App,2025-03-19,Suggestion,10,Southern make through subject pretty even sense someone policy its smile purpose century purpose learn south.,AGT155,1.29,South,Process,Customer Servicing,Product Feedback
FDB100242,CUST12967,Ryan Roy,Appliances,APP-338,Social Media,2025-06-26,Suggestion,10,Religious crime organization college owner world rule worker member list understand case.,AGT895,7.78,South,Process,Customer Servicing,Product Feedback
FDB100243,CUST16724,Kenneth Sampson,Sports,SPO-652,Social Media,2025-07-28,Complaint,5,Thousand pull mean sport stuff resource father fight last yet memory stage approach sure than series exist everyone small color half.,AGT787,43.88,South,Process,Customer Servicing,Product Feedback
FDB100244,CUST11769,Craig Wilson,Sports,SPO-396,Email,2024-11-23,Positive,7,Black wait open rise sing space and pay.,AGT673,23.67,East,Process,Customer Servicing,Product Feedback
FDB100245,CUST13233,Paul Zavala,Fashion,FAS-750,In-Store Kiosk,2025-07-13,Neutral,4,Room personal us car.,AGT681,45.65,South,Process,Customer Servicing,Product Feedback
FDB100246,CUST15210,Ricardo Sandoval,Automobile,AUT-430,In-Store Kiosk,2024-10-19,Neutral,4,Fine front hand enter point American process article finally keep.,AGT793,41.24,South,Process,Customer Servicing,Product Feedback
FDB100247,CUST10432,Martin Braun,Healthcare,HEA-113,In-Store Kiosk,2024-12-22,Suggestion,1,Worker property say material concern road line so born happy democratic begin.,AGT396,29.67,Central,Process,Customer Servicing,Product Feedback
FDB100248,CUST11961,Alexis Atkins,Electronics,ELE-268,Web Portal,2025-09-26,Neutral,7,Energy economy despite agreement reality yard different long son recent fly pretty recent others send director.,AGT444,23.43,West,Process,Customer Servicing,Product Feedback
FDB100249,CUST15936,Jessica Burton,Electronics,ELE-688,In-Store Kiosk,2024-11-05,Neutral,10,Hour method every raise author plan hit direction within political rise simple.,AGT249,41.82,South,Process,Customer Servicing,Product Feedback
FDB100250,CUST13850,Amy Garcia,Appliances,APP-779,Social Media,2025-06-24,Positive,2,Challenge maintain factor especially ok mission wall floor when detail.,AGT413,41.18,North,Process,Customer Servicing,Product Feedback
FDB100251,CUST16162,Ryan Carrillo,Fashion,FAS-458,Web Portal,2025-01-02,Positive,6,Physical time serve value teacher according factor catch detail test mother scientist one with.,AGT436,37.97,West,Process,Customer Servicing,Product Feedback
FDB100252,CUST14608,Danny Bender,Electronics,ELE-642,Social Media,2025-06-13,Suggestion,3,Agree degree question fear.,AGT983,8.52,North,Process,Customer Servicing,Product Feedback
FDB100253,CUST13399,Matthew Rodriguez,Healthcare,HEA-489,Social Media,2025-07-15,Suggestion,5,Rate safe often follow risk heavy all watch evening eat range at manage.,AGT484,1.78,Central,Process,Customer Servicing,Product Feedback
FDB100254,CUST10364,Jeffery Miller,Healthcare,HEA-592,Social Media,2025-08-08,Neutral,2,Institution society month color yard bank child.,AGT156,32.23,East,Process,Customer Servicing,Product Feedback
FDB100255,CUST17647,Lori Martin,Automobile,AUT-782,Mobile App,2025-03-14,Neutral,5,Quality moment material guy determine customer nearly that card wait heart million early wait.,AGT659,23.63,West,Process,Customer Servicing,Product Feedback
FDB100256,CUST11814,Jenny Hernandez,Electronics,ELE-929,Social Media,2025-09-25,Positive,4,Allow face possible just rich.,AGT317,4.22,Central,Process,Customer Servicing,Product Feedback
FDB100257,CUST19407,Claudia Day,Sports,SPO-312,Social Media,2024-12-20,Positive,10,Attorney nearly eat clear me section team newspaper.,AGT821,24.73,South,Process,Customer Servicing,Product Feedback
FDB100258,CUST10062,Angela Andrews,Electronics,ELE-984,Mobile App,2025-03-22,Suggestion,4,Religious financial production garden need space cup think break hold religious property there difficult before after inside.,AGT148,21.21,South,Process,Customer Servicing,Product Feedback
FDB100259,CUST17182,Wayne Lee,Sports,SPO-513,Email,2025-06-21,Complaint,1,Resource decide character side box set piece put top writer or rock seek five service.,AGT855,29.36,South,Process,Customer Servicing,Product Feedback
FDB100260,CUST18142,Jeffrey Hall,Sports,SPO-750,In-Store Kiosk,2024-10-30,Complaint,2,Head and interesting this color run treatment likely.,AGT444,16.1,East,Process,Customer Servicing,Product Feedback
FDB100261,CUST16791,Donna Liu,Fashion,FAS-994,Mobile App,2024-11-18,Complaint,1,Support meeting religious nothing guess authority city strategy soon environmental.,AGT918,17.19,Central,Process,Customer Servicing,Product Feedback
FDB100262,CUST17198,Michael Ball,Furniture,FUR-211,Social Media,2025-05-03,Negative,6,Research toward experience catch wife anything detail reduce.,AGT697,14.43,East,Process,Customer Servicing,Product Feedback
FDB100263,CUST19504,Steven Roberts,Appliances,APP-472,Web Portal,2025-09-15,Complaint,9,Measure participant phone particular probably.,AGT557,3.64,South,Process,Customer Servicing,Product Feedback
FDB100264,CUST15447,Travis Trujillo,Healthcare,HEA-845,Social Media,2025-01-24,Negative,9,Talk kid occur prove approach like cause sign.,AGT879,44.99,West,Process,Customer Servicing,Product Feedback
FDB100265,CUST15731,Joshua Lucas,Fashion,FAS-765,Web Portal,2025-04-07,Complaint,3,Data describe radio throughout.,AGT932,46.4,South,Process,Customer Servicing,Product Feedback
FDB100266,CUST19791,Devin Hill,Sports,SPO-253,Social Media,2025-02-13,Positive,5,Before range culture effect industry several best hold Congress to.,AGT342,47.1,North,Process,Customer Servicing,Product Feedback
FDB100267,CUST13249,Carla Chang,Fashion,FAS-470,Email,2025-09-17,Negative,8,Important measure what here develop water.,AGT597,6.07,East,Process,Customer Servicing,Product Feedback
FDB100268,CUST18996,David Stewart,Fashion,FAS-824,Mobile App,2025-09-26,Positive,8,Voice several speak upon sure its someone community memory bad cell walk protect pressure score conference guess age.,AGT673,3.47,West,Process,Customer Servicing,Product Feedback
FDB100269,CUST17124,Margaret Anderson MD,Healthcare,HEA-755,Email,2024-10-19,Complaint,2,Now sometimes energy seek serve test institution money easy game administration modern.,AGT168,38.94,North,Process,Customer Servicing,Product Feedback
FDB100270,CUST18204,Steven Harris,Appliances,APP-643,Email,2025-10-16,Positive,4,Certain story and computer trade vote statement.,AGT210,14.96,East,Process,Customer Servicing,Product Feedback
FDB100271,CUST16838,Christine Perkins,Sports,SPO-891,In-Store Kiosk,2025-04-23,Neutral,3,Executive every build TV return assume though range Mr store month lay fund seek.,AGT628,45.96,North,Process,Customer Servicing,Product Feedback
FDB100272,CUST10532,Paul Willis,Electronics,ELE-233,Social Media,2025-08-02,Positive,6,Guess change direction teacher according increase read suffer drug note everything without attention feeling perform feeling.,AGT331,14.15,South,Process,Customer Servicing,Product Feedback
FDB100273,CUST13612,Megan Soto,Furniture,FUR-388,Mobile App,2025-08-23,Positive,7,Yeah seek most case seven.,AGT310,21.21,Central,Process,Customer Servicing,Product Feedback
FDB100274,CUST12333,Andrea Quinn,Furniture,FUR-269,Email,2025-08-23,Negative,3,You in affect nature great through.,AGT490,5.66,West,Process,Customer Servicing,Product Feedback
FDB100275,CUST14257,Robert Williams,Sports,SPO-489,Email,2024-11-14,Complaint,5,Body performance big others land sure keep check teacher find.,AGT836,11.6,Central,Process,Customer Servicing,Product Feedback
FDB100276,CUST11034,Jennifer Maynard,Appliances,APP-499,Email,2024-10-18,Negative,6,Last hair necessary walk piece economic Democrat form maintain child attorney information.,AGT184,14.42,West,Process,Customer Servicing,Product Feedback
FDB100277,CUST10866,Wendy Hebert,Furniture,FUR-933,Social Media,2024-11-29,Complaint,1,Base model soon clear adult black thought art take.,AGT962,47.83,North,Process,Customer Servicing,Product Feedback
FDB100278,CUST14238,Heather Sims,Furniture,FUR-128,Social Media,2025-04-23,Neutral,8,Less indicate model candidate despite fast clear.,AGT651,40.01,North,Process,Customer Servicing,Product Feedback
FDB100279,CUST18370,James Adams,Fashion,FAS-686,In-Store Kiosk,2025-05-12,Neutral,1,Actually issue itself realize up statement probably garden public several necessary five able without technology event.,AGT195,33.16,Central,Process,Customer Servicing,Product Feedback
FDB100280,CUST12086,Timothy Brennan,Sports,SPO-880,Email,2025-01-02,Negative,6,Within radio father effort painting chance look across film.,AGT678,15.9,Central,Process,Customer Servicing,Product Feedback
FDB100281,CUST11486,Lisa Harris,Automobile,AUT-125,Email,2024-11-09,Suggestion,10,Use pick throw floor pay realize.,AGT592,9.81,Central,Process,Customer Servicing,Product Feedback
FDB100282,CUST17810,Alexis Lopez,Healthcare,HEA-494,Email,2025-04-11,Positive,1,Move still rich this true security spring tell.,AGT379,1.29,Central,Process,Customer Servicing,Product Feedback
FDB100283,CUST15305,Brenda Lopez,Automobile,AUT-660,Web Portal,2025-04-25,Positive,10,Evening wrong interesting agency similar unit.,AGT569,44.88,East,Process,Customer Servicing,Product Feedback
FDB100284,CUST16535,Danielle Clayton,Fashion,FAS-827,In-Store Kiosk,2025-07-11,Neutral,5,Ability once beyond whether same group.,AGT575,19.6,North,Process,Customer Servicing,Product Feedback
FDB100285,CUST11498,Tyler Johnson,Electronics,ELE-578,Email,2025-05-22,Suggestion,5,Wide Republican without ready hour fact.,AGT262,33.33,West,Process,Customer Servicing,Product Feedback
FDB100286,CUST14426,Monique Harris,Healthcare,HEA-922,In-Store Kiosk,2024-11-15,Suggestion,4,Condition image reality design take lead herself class break himself no weight.,AGT438,30.43,South,Process,Customer Servicing,Product Feedback
FDB100287,CUST13392,Bobby Austin,Sports,SPO-535,Web Portal,2025-05-26,Suggestion,1,Effect main admit company baby concern camera rule rich compare.,AGT114,38.83,Central,Process,Customer Servicing,Product Feedback
FDB100288,CUST15919,Shannon Bond,Furniture,FUR-712,Email,2025-05-01,Negative,4,Seem man reach base five true star rise natural star actually part fly.,AGT166,29.14,West,Process,Customer Servicing,Product Feedback
FDB100289,CUST12024,Peter Werner,Healthcare,HEA-216,Social Media,2025-08-04,Positive,5,Him will knowledge type deep already attorney director see.,AGT559,6.3,West,Process,Customer Servicing,Product Feedback
FDB100290,CUST16189,Kathryn Mason,Fashion,FAS-253,Mobile App,2024-10-28,Complaint,9,Mention mind election car executive research boy six concern check second expect.,AGT162,21.67,East,Process,Customer Servicing,Product Feedback
FDB100291,CUST17098,Patricia Vasquez,Automobile,AUT-139,Mobile App,2025-01-09,Positive,8,Six trip deep since scientist enough deal race allow available wish owner themselves knowledge cause situation military month.,AGT665,14.3,Central,Process,Customer Servicing,Product Feedback
FDB100292,CUST11287,David Mclaughlin,Fashion,FAS-220,Email,2025-05-21,Neutral,7,Sense research kind drop deal.,AGT726,45.83,North,Process,Customer Servicing,Product Feedback
FDB100293,CUST13687,John Robbins,Appliances,APP-413,Social Media,2025-10-13,Suggestion,8,Data hope single sound spring return story.,AGT592,17.85,East,Process,Customer Servicing,Product Feedback
FDB100294,CUST11817,Brittney Bennett,Electronics,ELE-818,In-Store Kiosk,2025-02-20,Suggestion,5,Easy hundred he painting give morning success determine head.,AGT622,35.5,East,Process,Customer Servicing,Product Feedback
FDB100295,CUST11006,Danielle Sanchez,Healthcare,HEA-711,Mobile App,2025-03-26,Neutral,10,Wind prepare young nation woman western everybody several health thus listen.,AGT782,35.83,East,Process,Customer Servicing,Product Feedback
FDB100296,CUST16560,Gary Schultz,Sports,SPO-250,Web Portal,2025-01-04,Positive,8,Better father wear house nor animal cultural her.,AGT886,40.91,North,Process,Customer Servicing,Product Feedback
FDB100297,CUST12256,Christopher Vaughn,Healthcare,HEA-156,In-Store Kiosk,2025-09-10,Neutral,3,Section model above environment administration hold air.,AGT614,10.89,East,Process,Customer Servicing,Product Feedback
FDB100298,CUST11577,Javier Walton,Healthcare,HEA-961,Web Portal,2025-08-09,Negative,5,Team card like build change specific safe detail kitchen many would enjoy leave.,AGT767,31.11,South,Process,Customer Servicing,Product Feedback
FDB100299,CUST19700,Darren Hamilton,Healthcare,HEA-471,Web Portal,2025-09-25,Positive,7,Yes myself as issue commercial role want success new.,AGT515,13.4,South,Process,Customer Servicing,Product Feedback
FDB100300,CUST15090,Tiffany Fuller,Electronics,ELE-142,In-Store Kiosk,2024-10-23,Suggestion,4,Have today continue occur yet ok real administration suggest imagine ready.,AGT685,20.02,Central,Process,Customer Servicing,Product Feedback
FDB100301,CUST15657,Margaret Moore,Healthcare,HEA-411,In-Store Kiosk,2025-02-28,Suggestion,8,Security sort area relate kitchen consider last matter party world response out month.,AGT237,23.79,North,Process,Customer Servicing,Product Feedback
FDB100302,CUST16810,Brenda Rodriguez,Appliances,APP-113,Email,2025-07-02,Suggestion,4,Energy age a north second buy official hospital computer little add.,AGT443,31.91,South,Process,Customer Servicing,Product Feedback
FDB100303,CUST13127,David Valentine,Healthcare,HEA-789,Email,2025-07-09,Suggestion,5,Seat win beyond music drive.,AGT823,3.89,North,Process,Customer Servicing,Product Feedback
FDB100304,CUST10100,David Walker,Healthcare,HEA-660,In-Store Kiosk,2025-05-14,Negative,10,Writer chair during their tonight benefit low student organization position home job enter.,AGT947,33.61,West,Process,Customer Servicing,Product Feedback
FDB100305,CUST13869,Dr. John Smith MD,Fashion,FAS-561,Email,2025-05-17,Negative,7,Story receive card sense behind apply spend east my no gas paper.,AGT278,12.41,East,Process,Customer Servicing,Product Feedback
FDB100306,CUST13185,Anthony Graham,Furniture,FUR-683,Web Portal,2024-12-15,Negative,4,Wife bag piece house perhaps skill perhaps source visit upon.,AGT657,10.24,West,Process,Customer Servicing,Product Feedback
FDB100307,CUST19656,Joseph Garcia,Sports,SPO-806,Social Media,2025-01-26,Complaint,6,Mr watch late woman suggest arm guess poor industry speak.,AGT307,14.01,West,Process,Customer Servicing,Product Feedback
FDB100308,CUST15381,Omar Hardy,Sports,SPO-118,Web Portal,2025-08-10,Neutral,2,Financial amount court believe already billion rate southern sister.,AGT542,5.08,South,Process,Customer Servicing,Product Feedback
FDB100309,CUST10050,Savannah Rodriguez,Sports,SPO-266,Mobile App,2025-08-04,Suggestion,6,Side Democrat box drive Mr pay edge rule floor us pattern structure realize.,AGT822,14.53,West,Process,Customer Servicing,Product Feedback
FDB100310,CUST15898,Jennifer Adams,Healthcare,HEA-172,Email,2025-09-19,Suggestion,1,Each big option manager forward argue unit.,AGT253,22.87,East,Process,Customer Servicing,Product Feedback
FDB100311,CUST17560,Joshua Decker,Furniture,FUR-138,Social Media,2025-10-03,Suggestion,5,Window none five contain indeed authority south especially give analysis stock wonder style gun.,AGT328,25.49,West,Process,Customer Servicing,Product Feedback
FDB100312,CUST12152,Megan Freeman,Appliances,APP-428,In-Store Kiosk,2025-06-05,Neutral,3,Case lay picture help.,AGT317,7.76,Central,Process,Customer Servicing,Product Feedback
FDB100313,CUST19053,Bradley Rivera,Sports,SPO-311,Mobile App,2025-08-19,Positive,10,Join natural baby guy network door fine down bring plan agent half.,AGT408,7.14,North,Process,Customer Servicing,Product Feedback
FDB100314,CUST16386,Danielle Price,Electronics,ELE-463,Web Portal,2025-05-01,Complaint,8,Military star leader tend member.,AGT965,5.76,North,Process,Customer Servicing,Product Feedback
FDB100315,CUST11980,Melissa Cunningham,Electronics,ELE-255,In-Store Kiosk,2025-05-23,Neutral,9,Worker security raise mouth include hold case must although nearly specific guess.,AGT694,47.95,East,Process,Customer Servicing,Product Feedback
FDB100316,CUST13795,Janice Mathis,Appliances,APP-717,Email,2025-01-26,Neutral,2,Development us also wonder watch politics Mrs onto much including talk learn address case teach follow.,AGT707,19.39,Central,Process,Customer Servicing,Product Feedback
FDB100317,CUST16467,Brenda Valencia,Fashion,FAS-818,Social Media,2024-10-22,Suggestion,9,Himself all how really individual follow ability statement public change look gas service hold draw.,AGT951,14.75,East,Process,Customer Servicing,Product Feedback
FDB100318,CUST18949,Jorge Jarvis,Healthcare,HEA-701,In-Store Kiosk,2025-01-15,Negative,2,Activity land care official.,AGT621,4.26,North,Process,Customer Servicing,Product Feedback
FDB100319,CUST15454,Jose Neal,Sports,SPO-195,Web Portal,2025-01-28,Positive,6,Support window power lawyer factor that garden because single Democrat beat.,AGT613,26.54,East,Process,Customer Servicing,Product Feedback
FDB100320,CUST13734,Dr. Isaac Houston,Furniture,FUR-648,Web Portal,2025-09-21,Suggestion,10,Activity southern side even team prepare either.,AGT525,5.56,West,Process,Customer Servicing,Product Feedback
FDB100321,CUST11888,Melissa Waters,Electronics,ELE-271,Social Media,2025-06-04,Negative,3,First pretty protect leave happen four hour.,AGT484,8.97,West,Process,Customer Servicing,Product Feedback
FDB100322,CUST16851,Carrie Ray,Healthcare,HEA-274,Email,2025-01-22,Suggestion,1,Particularly word ahead really business thank firm letter use yeah evidence quality reflect shake.,AGT743,18.84,Central,Process,Customer Servicing,Product Feedback
FDB100323,CUST14125,Michael York,Automobile,AUT-162,Mobile App,2025-01-04,Negative,6,Poor imagine practice young human agent play follow.,AGT991,35.71,West,Process,Customer Servicing,Product Feedback
FDB100324,CUST12342,Miss Megan Grant DVM,Automobile,AUT-754,Email,2025-10-11,Suggestion,4,Fire finish own miss close serious pay one brother and yet arrive field but though source.,AGT249,14.74,East,Process,Customer Servicing,Product Feedback
FDB100325,CUST18509,Tiffany Choi,Fashion,FAS-216,Mobile App,2025-07-24,Negative,4,Other may writer interest attorney change store.,AGT815,8.91,South,Process,Customer Servicing,Product Feedback
FDB100326,CUST16124,Leslie Ramirez,Fashion,FAS-649,Social Media,2025-02-06,Negative,10,Loss those air reflect across be morning prove but dream recently or management.,AGT370,3.46,South,Process,Customer Servicing,Product Feedback
FDB100327,CUST17509,Rebecca Gilbert,Electronics,ELE-708,In-Store Kiosk,2025-01-29,Suggestion,10,Field important member while radio home she young edge might save program party type wish authority just.,AGT220,4.15,East,Process,Customer Servicing,Product Feedback
FDB100328,CUST11811,Joseph Miller,Automobile,AUT-918,Social Media,2025-07-05,Positive,2,Former give vote common cause significant once discover.,AGT182,32.07,Central,Process,Customer Servicing,Product Feedback
FDB100329,CUST10560,Meagan Brooks,Fashion,FAS-910,Social Media,2025-02-10,Positive,10,Allow war decision chair check travel tax town.,AGT696,21.8,South,Process,Customer Servicing,Product Feedback
FDB100330,CUST19571,Mr. Jeffrey Summers II,Furniture,FUR-828,Web Portal,2024-10-28,Negative,9,Ball environmental opportunity center special easy thought exactly usually.,AGT564,32.19,Central,Process,Customer Servicing,Product Feedback
FDB100331,CUST15750,David Mendez,Fashion,FAS-293,Social Media,2024-10-26,Positive,8,Weight particularly town simply fast production heavy happen.,AGT688,35.84,West,Process,Customer Servicing,Product Feedback
FDB100332,CUST15715,Shawn Thompson,Fashion,FAS-173,Mobile App,2025-09-25,Negative,1,Along theory model power statement answer training wait water radio sit must model experience.,AGT934,2.26,Central,Process,Customer Servicing,Product Feedback
FDB100333,CUST16992,Andrew Perez,Automobile,AUT-421,Social Media,2025-02-17,Suggestion,5,To tell range with ever turn decade executive.,AGT859,46.76,North,Process,Customer Servicing,Product Feedback
FDB100334,CUST11312,Shawn Williams,Fashion,FAS-408,Email,2025-02-12,Positive,9,Increase style term hit their cut collection performance pressure head which deal any say current.,AGT170,5.65,Central,Process,Customer Servicing,Product Feedback
FDB100335,CUST17189,Tina Love,Healthcare,HEA-275,Mobile App,2025-09-27,Neutral,4,End night civil various industry president area food along again many green.,AGT819,35.76,North,Process,Customer Servicing,Product Feedback
FDB100336,CUST12283,Paul Morales,Furniture,FUR-899,Email,2025-09-17,Negative,2,Break police local close beautiful point how.,AGT460,15.62,Central,Process,Customer Servicing,Product Feedback
FDB100337,CUST19266,Mary Moore,Fashion,FAS-299,Web Portal,2025-03-20,Positive,4,Color nor political often however.,AGT515,38.39,West,Process,Customer Servicing,Product Feedback
FDB100338,CUST18009,Mrs. Lindsey Rogers,Healthcare,HEA-700,Web Portal,2025-03-29,Negative,4,Improve best TV record sea today style.,AGT190,9.8,East,Process,Customer Servicing,Product Feedback
FDB100339,CUST14822,Maria Hunter,Automobile,AUT-387,Mobile App,2025-10-08,Negative,1,Everybody difference forward.,AGT750,47.83,North,Process,Customer Servicing,Product Feedback
FDB100340,CUST17050,Mary Sullivan,Healthcare,HEA-587,Web Portal,2025-03-04,Complaint,2,Board service again entire expert charge pick truth great result environmental our.,AGT417,5.81,North,Process,Customer Servicing,Product Feedback
FDB100341,CUST16654,Melissa Hall,Appliances,APP-612,Mobile App,2025-10-09,Complaint,6,Protect man land somebody model operation throw upon statement.,AGT445,21.46,North,Process,Customer Servicing,Product Feedback
FDB100342,CUST18017,Jessica Davis,Sports,SPO-655,Email,2025-04-19,Neutral,6,Write network little task weight.,AGT678,20.66,South,Process,Customer Servicing,Product Feedback
FDB100343,CUST19194,Dr. Brian Cruz,Electronics,ELE-881,Mobile App,2025-03-13,Complaint,10,Recognize owner kid moment music cut if why break example.,AGT347,36.24,Central,Process,Customer Servicing,Product Feedback
FDB100344,CUST12049,Rebecca Bryant,Healthcare,HEA-194,Web Portal,2025-02-12,Suggestion,6,Summer event music message southern response artist.,AGT227,37.61,Central,Process,Customer Servicing,Product Feedback
FDB100345,CUST13393,Ryan Shaw,Electronics,ELE-897,In-Store Kiosk,2025-03-16,Neutral,5,Group agent field wife shoulder away everyone city.,AGT372,41.77,Central,Process,Customer Servicing,Product Feedback
FDB100346,CUST15109,Morgan Gonzales,Appliances,APP-533,Mobile App,2025-02-15,Neutral,6,Study white condition discussion room next according school deal factor policy building.,AGT341,30.02,North,Process,Customer Servicing,Product Feedback
FDB100347,CUST11406,Laura Lynch,Fashion,FAS-517,In-Store Kiosk,2025-01-19,Complaint,2,Discover ready each music despite high item up card too.,AGT379,41.73,East,Process,Customer Servicing,Product Feedback
FDB100348,CUST17946,Dr. Stephen Hogan PhD,Healthcare,HEA-803,Email,2025-03-25,Positive,1,Deep special maybe individual hope trouble choice.,AGT208,25.97,West,Process,Customer Servicing,Product Feedback
FDB100349,CUST18653,Valerie Harris,Fashion,FAS-776,Web Portal,2025-08-14,Complaint,2,Than give old whole avoid which.,AGT401,39.45,East,Process,Customer Servicing,Product Feedback
FDB100350,CUST19904,Alexander Olson,Appliances,APP-373,Web Portal,2025-01-22,Negative,10,Hard myself center culture shake teacher.,AGT729,6.69,Central,Process,Customer Servicing,Product Feedback
FDB100351,CUST17086,Cory Farrell,Electronics,ELE-397,Social Media,2025-08-24,Positive,2,Every little for.,AGT997,3.06,West,Process,Customer Servicing,Product Feedback
FDB100352,CUST15251,William Miles,Healthcare,HEA-830,Social Media,2024-11-02,Neutral,5,Nice teach sister executive point peace spend.,AGT417,19.29,North,Process,Customer Servicing,Product Feedback
FDB100353,CUST17243,Shane Mitchell,Automobile,AUT-671,In-Store Kiosk,2025-06-15,Positive,9,Risk window number whether list Republican nearly stand relationship price point firm reach.,AGT635,12.63,South,Process,Customer Servicing,Product Feedback
FDB100354,CUST13487,David Davis II,Furniture,FUR-275,In-Store Kiosk,2025-08-24,Complaint,4,Kitchen everybody there pretty letter through up on more ahead family bag defense reach.,AGT361,40.3,West,Process,Customer Servicing,Product Feedback
FDB100355,CUST17050,Donna Anderson,Appliances,APP-148,Web Portal,2025-05-03,Suggestion,10,Husband rule certainly choose court.,AGT129,6.51,North,Process,Customer Servicing,Product Feedback
FDB100356,CUST13438,Christopher Rogers,Sports,SPO-477,Mobile App,2024-12-26,Negative,8,Black never evidence alone join PM against beyond actually something bank during traditional.,AGT974,3.49,East,Process,Customer Servicing,Product Feedback
FDB100357,CUST16196,Bobby Robinson,Electronics,ELE-835,Mobile App,2025-04-17,Suggestion,7,Test himself job actually author opportunity cover of well popular perform relationship well ready because identify.,AGT748,6.9,Central,Process,Customer Servicing,Product Feedback
FDB100358,CUST18921,Holly Frederick,Automobile,AUT-303,Web Portal,2025-07-06,Positive,1,Change clear hold out education state.,AGT956,42.04,West,Process,Customer Servicing,Product Feedback
